video_path,ground_truth_label,vlm_raw_response,judge_score,judge_reasoning
videos/session_0743_tap.mp4,tap,Action: carrying a tray,0.1,"The predicted action 'carrying a tray' is semantically unrelated to the ground truth action 'tap'. The actions are completely different, and there is no temporal or contextual overlap."
videos/session_0744_spreadandpinch.mp4,spreadandpinch,Action: smoking,0.1,"The predicted action 'smoking' is completely unrelated to the ground truth action 'spreadandpinch', which likely involves hand movements. There is no semantic or temporal overlap between the two actions."
videos/session_0745_drawtriangle.mp4,drawtriangle,Action: waving,0.2,The predicted action 'waving' is completely different from the ground truth action 'drawtriangle'. There is no semantic or temporal overlap between the two actions.
videos/session_0746_sneeze.mp4,sneeze,Action: Talking on phone,0.1,The prediction 'Talking on phone' is completely different from the ground truth action 'sneeze'. There is no semantic or temporal overlap between the two actions.
videos/session_0747_cough.mp4,cough,Action: Talking on phone,0.2,The predicted action 'Talking on phone' is semantically unrelated to the ground truth action 'cough'. They are distinct actions with no overlap or temporal relation.
videos/session_0748_stagger.mp4,stagger,Action: standing,0.2,"The predicted action 'standing' is a static description, while the ground truth 'stagger' implies a dynamic and unsteady movement. The two actions are semantically unrelated, and the prediction fails to capture the dynamic nature of the ground truth action."
videos/session_0749_yawn.mp4,yawn,Action: Talking on phone,0.1,The predicted action 'Talking on phone' is completely unrelated to the ground truth action 'yawn'. There is no semantic or temporal overlap between the two actions.
videos/session_0750_blownose.mp4,blownose,Action: Talking on phone,0.2,The ground truth action 'blownose' and the predicted action 'talking on phone' are unrelated and describe completely different activities. There is no semantic or temporal overlap between the two.
videos/session_0751_stretchoneself.mp4,stretchoneself,Action: waving arms,0.8,"The prediction 'waving arms' is semantically similar to 'stretchoneself', as both involve arm movements. While not an exact match, the actions are closely related and plausibly describe the same activity."
videos/session_0752_touchface.mp4,touchface,Action: Talking on the phone,0.2,"The predicted action 'talking on the phone' is unrelated to the ground truth action 'touchface'. While both may involve hand-to-face proximity, the intent and context are different, leading to a low score."
videos/session_0753_sit.mp4,sit,Action: Sitting down,1.0,"The prediction 'Sitting down' is a valid temporal part of the ground truth action 'sit', as it directly describes the process of transitioning into the sitting position."
videos/session_0754_walk.mp4,walk,Action: standing,0.2,"The ground truth action is 'walk', which is a dynamic movement, while the predicted action is 'standing', a static pose. These are fundamentally different and do not have a clear temporal or semantic relationship, resulting in a low score."
videos/session_0755_bow.mp4,bow,Action: bending down,1.0,"The prediction 'bending down' is semantically equivalent to the ground truth action 'bow', as both describe a similar downward bending motion."
videos/session_0756_sleep.mp4,sleep,Action: lying,1.0,"The predicted action 'lying' is a semantic equivalent of the ground truth action 'sleep', as lying is the primary posture associated with sleeping."
videos/session_0757_dance.mp4,dance,Action: boxing,0.2,"The predicted action 'boxing' is a completely different action from the ground truth 'dance', with no semantic overlap or temporal relationship."
videos/session_0758_jog.mp4,jog,Action: drinking,0.1,"The predicted action 'drinking' is completely unrelated to the ground truth action 'jog', which involves dynamic movement. There is no semantic or temporal overlap."
videos/session_0759_falldown.mp4,falldown,Action: sitting down,0.2,"The predicted action 'sitting down' is semantically opposite to the ground truth action 'falldown'. While both involve a change in posture, 'sitting down' implies a controlled, intentional movement, whereas 'falldown' suggests an uncontrolled, accidental action. The two are not related in a meaningful way."
videos/session_0760_handshake.mp4,handshake,Action: handshake,1.0,The prediction 'handshake' exactly matches the ground truth action 'handshake'.
videos/session_0761_hug.mp4,hug,Action: handshake,0.3,"The VLM predicted 'handshake', which is a completely different action from the ground truth 'hug'. Both are social interactions, but they are semantically distinct and not interchangeable."
videos/session_0762_pushsomeone.mp4,pushsomeone,Action: shaking hands,0.4,"The prediction 'shaking hands' involves some form of interaction with another person, which is vaguely related to 'pushsomeone'. However, the actions are semantically distinct and not equivalent, hence a medium score."
videos/session_0763_kicksomeone.mp4,kicksomeone,Action: talking,0.1,"The predicted action 'talking' is completely unrelated to the ground truth action 'kicksomeone', which involves a physical interaction. There is no semantic or temporal overlap between the two actions."
videos/session_0764_punchsomeone.mp4,punchsomeone,Action: lighting a cigarette,0.0,The predicted action 'lighting a cigarette' is completely unrelated to the ground truth action 'punchsomeone'. There is no semantic or contextual overlap between the two actions.
videos/session_0765_conversation.mp4,conversation,Action: shaking hands,0.5,"The predicted action 'shaking hands' is a form of interaction, which is related to 'conversation' but not a direct match. It is a plausible but less specific interpretation of the ground truth label."
videos/session_0766_jump.mp4,jump,Action: standing,0.1,"The ground truth action is 'jump', which is a dynamic and specific movement. The VLM's prediction 'standing' is a static and unrelated action, indicating a clear mismatch."
videos/session_0767_jumpingjack.mp4,jumpingjack,Action: jumping jacks,1.0,The prediction 'jumping jacks' is an exact match to the ground truth action 'jumpingjack'.
videos/session_0768_squat.mp4,squat,Action: shooting rifle,0.0,The predicted action 'shooting rifle' is completely unrelated to the ground truth action 'squat'. There is no semantic or contextual overlap between the two actions.
videos/session_0769_lunge.mp4,lunge,Action: kicking,0.3,"The predicted action 'kicking' is significantly different from the ground truth action 'lunge'. While both involve leg movements, the mechanics and intent are distinct, resulting in a low similarity score."
videos/session_0770_turn.mp4,turn,Action: standing,0.2,"The prediction 'standing' is a static action and does not align with the dynamic ground truth action 'turn'. There is no clear semantic or temporal relationship between the two, resulting in a low score."
videos/session_0771_pushup.mp4,pushup,Action: push-up,1.0,"The prediction 'push-up' is a semantic equivalent of the ground truth action 'pushup', indicating a perfect match."
videos/session_0772_legraise.mp4,legraise,Action: kicking,0.8,"The predicted action 'kicking' is semantically similar to the ground truth 'legraise', as both involve leg movement. While not an exact match, the actions are closely related and the VLM captures the essence of the movement."
videos/session_0773_airdrum.mp4,airdrum,Action: Clapping,0.2,"The VLM's predicted action 'Clapping' is semantically different from the ground truth action 'airdrum'. While both involve hand movements, the specific action of mimicking drumming is not captured by clapping, resulting in a low score."
videos/session_0774_boxing.mp4,boxing,Action: punching,0.9,"The prediction 'punching' is a specific and core component of the ground truth action 'boxing', making it semantically equivalent and highly accurate."
videos/session_0775_shakehead.mp4,shakehead,Action: standing,0.2,"The ground truth 'shakehead' is a specific dynamic action, while the prediction 'standing' is a generic static action. There is no semantic or temporal relationship between the two, resulting in a low score."
videos/session_0776_answerphone.mp4,answerphone,Action: Talking on phone,1.0,"The predicted action 'Talking on phone' is a direct semantic equivalent of the ground truth 'answerphone', indicating the same activity."
videos/session_0777_eat.mp4,eat,Action: smoking,0.1,The predicted action 'smoking' is completely unrelated to the ground truth action 'eat'. There is no semantic or temporal overlap between these actions.
videos/session_0778_drink.mp4,drink,Action: Drinking,1.0,The prediction 'Drinking' is a direct and semantically equivalent match to the ground truth action 'drink'.
videos/session_0779_wipeface.mp4,wipeface,Action: taking a selfie,0.3,"The predicted action 'taking a selfie' is semantically different from the ground truth 'wipeface'. Both actions involve hand-to-face interaction, but the intent and context are distinct. Wiping the face is a hygiene-related action, while taking a selfie is a photography-related action. Therefore, the score is low."
videos/session_0780_pickup.mp4,pickup,Action: bending down,0.8,"The prediction 'bending down' is a plausible precursor or part of the 'pickup' action, making it semantically related and contextually valid."
videos/session_0781_jumprope.mp4,jumprope,Action: Jump rope,1.0,The prediction 'Jump rope' is an exact match to the ground truth action 'jumprope'.
videos/session_0782_moppingfloor.mp4,moppingfloor,Action: folding the tripod,0.0,The predicted action 'folding the tripod' is completely unrelated to the ground truth action 'moppingfloor'. There is no semantic or contextual overlap between the two actions.
videos/session_0783_brushhair.mp4,brushhair,Action: salute,0.1,The predicted action 'salute' is completely unrelated to the ground truth action 'brushhair'. There is no semantic or temporal overlap between the two actions.
videos/session_0784_bicepcurl.mp4,bicepcurl,Action: bicep curl,1.0,The prediction 'Action: bicep curl' is an exact match to the ground truth action 'bicepcurl'.
videos/session_0785_playphone.mp4,playphone,Action: using phone,1.0,The prediction 'using phone' is a semantic equivalent of the ground truth action 'playphone'.
videos/session_0786_brushteeth.mp4,brushteeth,Action: smoking,0.0,The prediction 'smoking' is completely unrelated to the ground truth action 'brushteeth'. There is no semantic or contextual overlap between the two actions.
videos/session_0787_type.mp4,type,Action: typing,1.0,The prediction 'typing' is a direct and accurate match for the ground truth action 'type'.
videos/session_0788_thumbup.mp4,thumbup,Action: thumbs up,1.0,The prediction 'thumbs up' is an exact semantic match to the ground truth action 'thumbup'.
videos/session_0789_thumbdown.mp4,thumbdown,Action: reaching,0.5,"The prediction 'reaching' is somewhat related to 'thumbdown' as it involves arm movement, but it is not specific enough to capture the distinct action of giving a thumbs-down gesture."
videos/session_0790_makeoksign.mp4,makeoksign,Action: waving,0.1,"The predicted action 'waving' is semantically unrelated to the ground truth action 'makeoksign'. Both are specific hand gestures, but they are distinct and not temporally or semantically connected."
videos/session_0791_makevictorysign.mp4,makevictorysign,Action: waving,0.2,"The predicted action 'waving' is semantically unrelated to the ground truth 'makevictorysign'. Both involve hand movements, but the specific gesture and intent are completely different."
videos/session_0792_drawcircleclockwise.mp4,drawcircleclockwise,Action: waving,0.2,"The predicted action 'waving' does not align with the ground truth action 'drawcircleclockwise', which involves a specific circular hand movement. These are distinct and unrelated actions, warranting a low score."
videos/session_0793_drawcirclecounterclockwise.mp4,drawcirclecounterclockwise,Action: waving,0.2,"The predicted action 'waving' is semantically unrelated to the ground truth action 'drawcirclecounterclockwise'. Both actions involve hand movements, but their execution and intent are fundamentally different, leading to a low score."
videos/session_0794_stopsign.mp4,stopsign,Action: waving,0.0,The prediction 'waving' is completely different from the ground truth action 'stopsign'. There is no semantic or temporal relationship between the two actions.
videos/session_0795_pullhandin.mp4,pullhandin,Action: drinking,0.2,The predicted action 'drinking' is completely unrelated to the ground truth action 'pullhandin'. There is no semantic or contextual overlap between the two actions.
videos/session_0796_pushhandaway.mp4,pushhandaway,Action: waving,0.2,The predicted action 'waving' does not match the ground truth action 'pushhandaway' either semantically or as a temporal part. The two actions are distinct and unrelated.
videos/session_0797_handwave.mp4,handwave,Action: waving,1.0,The VLM's prediction 'waving' is a direct semantic match to the ground truth action 'handwave'.
videos/session_0798_sweep.mp4,sweep,"Action: smoking

## Explanation

The reasoning process analyzes the provided thermal infrared video frames to identify the human action based on key characteristics of low-resolution thermal imaging: brighter pixels indicate heat sources (e.g., body parts), static cold background, and subtle motion in limb positions.

1. **Frame Sequence Observation**: The 11 frames depict a single person standing stationary with legs straight and torso upright throughout. The primary variation occurs in the right arm (viewer's left), which repeatedly raises (bent at the elbow, forearm directed toward the face/head region) and lowers to the side. This pattern is evident in frames 5-6 (arm up), frame 7 (arm down), frame 8 (arm up), and frame 11 (arm partially raised), indicating a repetitive up-and-down motion.

2. **Pose Analysis**: The raised arm position shows the elbow extended outward and the hand positioned at face level (mid-to-lower head blob in thermal signature). This creates a compact gesture where the hand approaches and merges partially with the hot facial region, consistent with actions involving the mouth or lower face. No external objects (e.g., bottles, phones) are discernible as extended hot signatures, ruling out drinking or calling.

3. **Action Differentiation**: 
   - Ruled out static poses like ""standing"" due to dynamic arm movement.
   - Eliminated ""adjusting glasses"" or ""scratching head"" as these are typically singular, non-repetitive motions and would position the hand higher (forehead level), whereas the gesture aligns lower.
   - Dismissed ""saluting"" or ""waving"" due to lack of full arm extension or swinging motion; the elbow-out, compact raise is too contained.
   - ""Smoking"" best matches: the repetitive hand-to-mouth cycle is a hallmark of this action in HAR datasets, especially in surveillance contexts. Low-resolution thermal imaging often obscures small objects like cigarettes, focusing on the biomechanical pattern.

4. **Contextual Fit for Thermal HAR**: In intelligent surveillance, smoking is a common detectable action due to its distinct temporal periodicity and minimal full-body displacement. The static background and isolated figure reinforce this as the specific, ongoing activity across the sequence.",0.0,The predicted action 'smoking' is completely different from the ground truth action 'sweep'. There is no semantic or temporal overlap between the two actions.
videos/session_0799_clap.mp4,clap,Action: drumming,0.2,"The predicted action 'drumming' is semantically and visually distinct from the ground truth action 'clap'. While both involve hand movements, the context and intent of the actions are different, and they cannot be considered equivalent or related in a meaningful way."
videos/session_0800_slide.mp4,slide,Action: using phone,0.1,The prediction 'using phone' does not match the ground truth action 'slide' either semantically or temporally. They are unrelated actions.
videos/session_0801_drawzigzag.mp4,drawzigzag,Action: pointing,0.6,"The prediction 'pointing' is a plausible but less specific action compared to the ground truth 'drawzigzag'. While drawing zigzag may involve pointing movements, the prediction does not fully capture the specific nature of the ground truth action."
videos/session_0802_dodge.mp4,dodge,Action: using phone,0.1,"The prediction 'using phone' is completely unrelated to the ground truth action 'dodge', which involves a quick evasive movement. The actions are semantically distinct and there is no overlap."
videos/session_0803_bowling.mp4,bowling,Action: golf swing,0.2,"The predicted action 'golf swing' is semantically distinct from the ground truth action 'bowling'. While both are sports-related, they involve different movements and contexts, and there is no temporal or abstract relationship that would make the prediction correct."
videos/session_0804_liftupahand.mp4,liftupahand,Action: standing,0.2,"The ground truth action 'liftupahand' is a specific movement, while the prediction 'standing' is a generic static posture that does not align with the action of lifting a hand."
videos/session_0805_tap.mp4,tap,Action: Talking on phone,0.2,"The VLM predicted 'Talking on phone', which is unrelated to the ground truth action 'tap'. The two actions are semantically different and do not share any contextual or temporal similarity."
videos/session_0806_spreadandpinch.mp4,spreadandpinch,Action: drinking,0.1,"The predicted action 'drinking' is completely different from the ground truth action 'spreadandpinch', which involves hand movements unrelated to drinking."
videos/session_0807_drawtriangle.mp4,drawtriangle,Action: conducting,0.3,The predicted action 'conducting' is semantically unrelated to the ground truth action 'drawtriangle'. There is no clear overlap or temporal relationship between the two actions.
videos/session_0808_sneeze.mp4,sneeze,Action: coughing,0.9,"The predicted action 'coughing' is semantically very similar to the ground truth 'sneeze', both being respiratory reflex actions. While not identical, they are closely related and contextually plausible."
videos/session_0809_cough.mp4,cough,Action: standing,0.2,"The ground truth action is 'cough', which is a specific, involuntary action. The VLM's prediction 'standing' is a generic static pose and does not semantically relate to coughing. There is no overlap or plausible connection between the two actions."
videos/session_0810_stagger.mp4,stagger,Action: turning,0.6,"The prediction 'turning' is somewhat related to 'stagger' as both involve body movement, but 'turning' is less specific and does not fully capture the unsteady or unbalanced nature of 'stagger'. It is a plausible but incomplete description of the action."
videos/session_0811_yawn.mp4,yawn,Action: Smoking,0.1,The predicted action 'Smoking' is completely different from the ground truth action 'yawn'. There is no semantic or temporal relationship between the two actions.
videos/session_0812_blownose.mp4,blownose,Action: smoking,0.0,The predicted action 'smoking' is completely unrelated to the ground truth action 'blownose'. There is no semantic or contextual overlap between the two actions.
videos/session_0813_stretchoneself.mp4,stretchoneself,Action: two-hand waving,0.6,"The predicted action 'two-hand waving' is somewhat related to 'stretchoneself' as both involve arm movements, but it lacks the specificity of stretching and focuses more on waving. Therefore, it falls in the medium score range."
videos/session_0814_touchface.mp4,touchface,Action: Coughing,0.2,"The predicted action 'coughing' is semantically unrelated to the ground truth action 'touchface'. While both involve the head/face area, the intent and nature of the actions are distinct. Coughing is an involuntary reflex, whereas touchface is a voluntary interaction with the face."
videos/session_0815_handshake.mp4,handshake,Action: shaking hands,1.0,The prediction 'shaking hands' is a direct semantic equivalent of the ground truth action 'handshake'.
videos/session_0816_hug.mp4,hug,Action: Hugging,1.0,The prediction 'Action: Hugging' is a direct and accurate match to the ground truth action 'hug'.
videos/session_0817_pushsomeone.mp4,pushsomeone,Action: patting shoulder,0.8,"The predicted action 'patting shoulder' is semantically close to the ground truth 'pushsomeone', as both involve physical contact with another person's upper body. While 'pushsomeone' implies more force, 'patting shoulder' is a related interaction."
videos/session_0818_kicksomeone.mp4,kicksomeone,Action: Kicking,1.0,"The prediction 'Action: Kicking' is a semantic equivalent to the ground truth action 'kicksomeone', indicating a correct match."
videos/session_0819_punchsomeone.mp4,punchsomeone,Action: patting on shoulder,0.2,"The predicted action 'patting on shoulder' is semantically different from the ground truth 'punchsomeone'. While both involve physical interaction, the intent and motion are not closely related, warranting a low score."
videos/session_0820_conversation.mp4,conversation,Action: shaking hands,0.6,"The predicted action 'shaking hands' is a plausible interaction that could occur during a conversation, but it is not a direct equivalent or necessary part of the conversation. It is related but not specific enough for a higher score."
videos/session_0821_gym.mp4,gym,Action: standing,0.2,"The ground truth 'gym' implies a dynamic activity, but the VLM predicted 'standing', which is a generic static description. This does not align with the dynamic nature of the label, warranting a low score."
videos/session_0822_freestyle.mp4,freestyle,Action: Drinking,0.2,"The predicted action 'Drinking' is a specific activity that does not align with the abstract label 'freestyle', which encompasses a wide range of movements. Drinking is too specific and unrelated to the general context of 'freestyle' action."
videos/session_0823_gym.mp4,gym,Action: waving hands,0.8,"The predicted action 'waving hands' is a specific and plausible movement that falls under the abstract label 'gym'. While not a typical gym exercise, it is an active motion that could be part of a warm-up or free movement session, making it a reasonable match."
videos/session_0824_freestyle.mp4,freestyle,Action: Picking up object,0.8,"The ground truth 'freestyle' allows for any voluntary movement, and 'picking up object' is a specific action that fits within this abstract category. Although not exact, it is a valid interpretation of the freestyle label."
videos/session_0825_gym.mp4,gym,Action: Picking up object,0.8,"The predicted action 'Picking up object' is a specific, plausible activity that could occur during a gym workout, such as handling weights or equipment. While not explicitly an exercise, it aligns with the abstract nature of the 'gym' label, making it a valid and specific action."
videos/session_0826_freestyle.mp4,freestyle,Action: squatting,0.9,"The prediction 'squatting' is a specific valid action for the abstract ground truth label 'freestyle', which encompasses any voluntary movement. Squatting is a dynamic and reasonable action under 'freestyle'."
videos/session_0827_gym.mp4,gym,Action: standing,0.2,"The ground truth 'gym' implies dynamic exercise activity, but the prediction 'standing' is a generic static description that does not reflect the dynamic nature of the label."
videos/session_0828_freestyle.mp4,freestyle,Action: waving,0.9,"The predicted action 'waving' is a specific and valid movement under the abstract label 'freestyle', which allows for any voluntary action. Since 'waving' is a dynamic and reasonable interpretation of 'freestyle', it aligns well with the ground truth."
videos/session_0829_gym.mp4,gym,Action: drinking,0.2,"The predicted action 'drinking' is completely unrelated to the ground truth action 'gym', which encompasses dynamic exercises or movements. Drinking is a static, non-exercise activity and does not align with the expected context of a gym action."
videos/session_0830_freestyle.mp4,freestyle,Action: Drinking,0.2,"The ground truth 'freestyle' encompasses a wide range of dynamic actions, while the VLM's prediction 'Drinking' is a highly specific and static action that does not fit the context of a freeform movement. The actions are semantically unrelated, warranting a low score."
videos/session_0831_gym.mp4,gym,Action: waving,0.3,"The ground truth 'gym' encompasses a wide range of dynamic exercises, but 'waving' is a very specific and low-intensity action that does not typically represent gym activity. While 'waving' is an action, it does not align with the expected dynamic and vigorous nature of gym exercises, resulting in a low score."
videos/session_0832_freestyle.mp4,freestyle,Action: walking,0.8,"The ground truth 'freestyle' encompasses any active movement, and the VLM's prediction 'walking' is a specific and valid action within this abstract label. Therefore, the prediction is correct and semantically aligned with the ground truth."
videos/session_0833_gym.mp4,gym,Action: Standing,0.2,"The ground truth 'gym' implies dynamic activity like exercise, while the prediction 'standing' is a static description. This is a mismatch per the evaluation criteria."
videos/session_0834_freestyle.mp4,freestyle,Action: stabbing,0.2,"The prediction 'stabbing' is a violent and specific action that does not align with the abstract and general nature of the 'freestyle' label, which allows for any non-violent movement. There is no semantic or contextual similarity."
