video_path,ground_truth_label,vlm_raw_response,judge_score,judge_reasoning
videos/session_0001_sit.mp4,sit,Action: standing,0.2,The prediction 'standing' is a generic static description and does not align with the dynamic or temporal aspects of the ground truth action 'sit'. It fails to capture the relevant activity or its temporal progression.
videos/session_0002_bow.mp4,bow,Action: Bending,1.0,"The prediction 'Bending' is semantically equivalent to the ground truth action 'bow', as both involve lowering the upper body as a gesture of respect or greeting."
videos/session_0003_sleep.mp4,sleep,Action: Lying,1.0,"The prediction 'Lying' is semantically equivalent to the ground truth action 'sleep', as lying is a common posture associated with sleeping."
videos/session_0004_dance.mp4,dance,Action: clapping,0.5,"The predicted action 'clapping' is a form of movement and could be considered a type of dance, but it is too specific and not semantically equivalent to the broader category of 'dance'. Therefore, it falls into the medium score range as a related but less specific action."
videos/session_0005_jog.mp4,jog,Action: dancing,0.3,"The prediction 'dancing' is semantically different from the ground truth 'jog'. While both are dynamic actions, they represent distinct activities with no overlap in context or movement patterns."
videos/session_0006_falldown.mp4,falldown,Action: picking up object,0.2,"The predicted action 'picking up object' is unrelated to the ground truth action 'falldown'. There is no semantic or temporal connection between the two actions, and they describe entirely different movements."
videos/session_0007_jump.mp4,jump,"Action: punching

## Explanation

The reasoning process for identifying the action ""punching"" follows a systematic analysis of the thermal infrared video sequence, adhering to principles of Human Activity Recognition (HAR) in low-resolution thermal imagery.

1. **Frame-by-frame posture analysis**: The 10 frames depict a single heat signature (human figure) against a static, cold background. Frames 1-4 and 7-10 show a consistent upright standing pose with arms extended downward along the torso and legs straight, indicating an idle or stationary state. Frames 5 and 6 deviate significantly: the figure exhibits bent knees, a slight forward lean, and arms extended forward (right arm prominently straight ahead in frame 5, both arms outward in frame 6), forming a dynamic, transient motion.

2. **Thermal feature extraction**: Brighter pixel clusters outline the head (with mask-like hotspot), torso, arms, and legs. The arm extensions in frames 5-6 create elongated heat blobs projecting forward from the body centerline, a hallmark of ballistic limb motion in thermal silhouettes. No other heat sources (e.g., objects) interact with the figure, confirming isolated human action.

3. **Temporal sequence interpretation**: The brief excursion (frames 5-6) from standing to forward arm extension and partial retraction aligns with a rapid, unidirectional strike pattern. This matches ""punching"" in HAR datasets (e.g., thermal variants of UCF-101 or custom surveillance sets), where punches feature quick arm protraction, torso stabilization, and return to neutralâ€”distinct from waving (oscillatory), reaching (sustained), or pushing (bilateral symmetry).

4. **Discrimination from alternatives**: 
   - Not ""standing/idle"": Motion disrupts stasis.
   - Not ""waving"": Lacks repetitive up-down or side-to-side oscillation.
   - Not ""reaching"": Insufficient sustained hold or object interaction.
   - Contextual fit: Office setting with no props rules out object-manipulative actions; pose resembles solo striking (e.g., shadowboxing).

5. **HAR confidence factors**: Silhouette dynamics, motion brevity (~20% of sequence), and lack of locomotion prioritize upper-body aggressive gestures. Thermal limitations (no texture) emphasize kinematic cues, yielding ""punching"" as the optimal label per surveillance HAR protocols.",0.2,The VLM predicted 'punching' while the ground truth is 'jump'. These are entirely different actions with no semantic overlap. The prediction does not align with the ground truth or any temporal part of it.
videos/session_0008_jumpingjack.mp4,jumpingjack,Action: stretching,0.4,"The prediction 'stretching' is related to exercise but is not semantically equivalent to 'jumpingjack'. It is a plausible but less specific action, warranting a medium score."
videos/session_0009_squat.mp4,squat,Action: punching,0.1,The prediction 'punching' is a completely different action from the ground truth 'squat'. There is no semantic or temporal overlap between the two actions.
videos/session_0010_lunge.mp4,lunge,Action: standing,0.2,"The ground truth action 'lunge' is a dynamic exercise, while the VLM's prediction 'standing' is a static action. This does not capture the dynamic nature of the lunge, resulting in a low score."
videos/session_0011_turn.mp4,turn,Action: turning,1.0,The predicted action 'turning' is a direct semantic equivalent of the ground truth action 'turn'.
videos/session_0012_pushup.mp4,pushup,Action: crawling,0.2,The predicted action 'crawling' is significantly different from the ground truth action 'pushup'. Both actions involve body movement but are fundamentally distinct in posture and motion.
videos/session_0013_legraise.mp4,legraise,Action: punching,0.1,"The predicted action 'punching' is semantically and visually unrelated to the ground truth action 'legraise'. There is no overlap in the type of movement, body part involved, or context, making this a clear mismatch."
videos/session_0014_airdrum.mp4,airdrum,Action: clapping,0.2,"The predicted action 'clapping' is semantically different from the ground truth action 'airdrum'. While both involve hand movements, 'airdrum' is a specific action mimicking drumming, whereas 'clapping' is a distinct action involving striking hands together."
videos/session_0015_boxing.mp4,boxing,Action: punching,0.9,"The prediction 'punching' is a specific and accurate component of the ground truth action 'boxing', which heavily involves punching. The high semantic overlap justifies a high score."
videos/session_0016_shakehead.mp4,shakehead,Action: standing,0.2,"The ground truth action 'shakehead' is a specific head movement, while the VLM predicted 'standing', which is a static and unrelated action. There is no semantic overlap or temporal relationship between the two actions."
videos/session_0017_answerphone.mp4,answerphone,Action: Talking on phone,1.0,The prediction 'Talking on phone' is a direct semantic equivalent of the ground truth action 'answerphone'.
videos/session_0018_eat.mp4,eat,Action: putting on a face mask,0.1,The predicted action 'putting on a face mask' is completely unrelated to the ground truth action 'eat'. There is no semantic or contextual overlap between the two actions.
videos/session_0019_drink.mp4,drink,Action: drinking,1.0,The prediction 'drinking' is a direct semantic match for the ground truth action 'drink'.
videos/session_0020_wipeface.mp4,wipeface,Action: talking on the phone,0.0,The predicted action 'talking on the phone' is completely unrelated to the ground truth action 'wipeface'. There is no semantic or temporal overlap between the two actions.
videos/session_0021_pickup.mp4,pickup,Action: Picking up object,1.0,The prediction 'Picking up object' is a semantic equivalent of the ground truth action 'pickup'.
videos/session_0022_jumprope.mp4,jumprope,Action: waving hands,0.2,"The prediction 'waving hands' does not match the ground truth action 'jumprope' either semantically or functionally. They are completely different actions, with no overlap in movement or intent."
videos/session_0023_moppingfloor.mp4,moppingfloor,"Action: speaking into a microphone  
(or presenting/lecturing)",0.0,The predicted action 'speaking into a microphone (or presenting/lecturing)' is completely unrelated to the ground truth action 'moppingfloor'. There is no semantic overlap or plausible connection between the two actions.
videos/session_0024_brushhair.mp4,brushhair,Action: Talking on phone,0.1,The VLM's prediction 'Talking on phone' is completely unrelated to the ground truth action 'brushhair'. There is no semantic or temporal overlap between the two actions.
videos/session_0025_bicepcurl.mp4,bicepcurl,Action: putting on a face mask,0.0,The predicted action 'putting on a face mask' is completely unrelated to the ground truth action 'bicepcurl'. There is no semantic or contextual similarity between the two actions.
videos/session_0026_playphone.mp4,playphone,Action: talking on phone,1.0,"The prediction 'talking on phone' is a semantic equivalent to the ground truth action 'playphone', as both describe the same activity of using a phone."
videos/session_0027_brushteeth.mp4,brushteeth,Action: smoking,0.1,"The predicted action 'smoking' is completely unrelated to the ground truth action 'brushteeth'. Both actions involve different objects and movements, with no semantic overlap or temporal relationship."
videos/session_0028_type.mp4,type,Action: playing video game,0.2,"The ground truth action 'type' involves using a keyboard, while the VLM predicted 'playing video game'. Although both involve interacting with a device, 'playing video game' is a distinct activity and not a semantic equivalent of 'typing'."
videos/session_0029_thumbup.mp4,thumbup,Action: Thumbs up gesture,1.0,"The prediction 'Thumbs up gesture' is a semantic equivalent of the ground truth action 'thumbup', indicating an exact match."
videos/session_0030_thumbdown.mp4,thumbdown,Action: waving,0.1,The predicted action 'waving' is completely different from the ground truth action 'thumbdown'. There is no semantic or temporal overlap between the two actions.
videos/session_0031_makeoksign.mp4,makeoksign,Action: raising hand,0.4,"The predicted action 'raising hand' is somewhat related to 'makeoksign' as both involve hand gestures, but it is not a specific or accurate description of the ground truth action."
videos/session_0032_makevictorysign.mp4,makevictorysign,Action: Making peace sign,1.0,"The prediction 'Making peace sign' is a semantic equivalent of the ground truth action 'makevictorysign', as both describe the same hand gesture."
videos/session_0033_drawcircleclockwise.mp4,drawcircleclockwise,Action: waving,0.2,"The predicted action 'waving' is significantly different from the ground truth action 'drawcircleclockwise'. While both involve arm movements, the specific motion and intent are not semantically equivalent, resulting in a low score."
videos/session_0034_drawcirclecounterclockwise.mp4,drawcirclecounterclockwise,Action: waving,0.2,The prediction 'waving' is a completely different action from the ground truth 'drawcirclecounterclockwise'. There is no semantic or temporal overlap between the two actions.
videos/session_0035_stopsign.mp4,stopsign,Action: waving,0.1,The predicted action 'waving' is completely unrelated to the ground truth action 'stopsign'. There is no semantic or contextual overlap between the two actions.
videos/session_0036_pullhandin.mp4,pullhandin,Action: waving,0.2,"The predicted action 'waving' is semantically different from the ground truth 'pullhandin'. While both involve hand movements, the context and intent are not aligned, leading to a low score."
videos/session_0037_pushhandaway.mp4,pushhandaway,Action: waving,0.4,"The prediction 'waving' is somewhat related to 'pushhandaway' as both involve hand movements, but they are not semantically equivalent or temporally related. The actions differ significantly in intent and execution."
videos/session_0038_handwave.mp4,handwave,Action: hand waving,1.0,The prediction 'hand waving' is a direct semantic equivalent of the ground truth action 'handwave'.
videos/session_0039_sweep.mp4,sweep,Action: waving,0.2,"The predicted action 'waving' is semantically different from the ground truth action 'sweep'. While both involve arm movements, the context and intent of the actions are distinct, leading to a low similarity score."
videos/session_0040_clap.mp4,clap,Action: waving,0.2,"The predicted action 'waving' is semantically different from the ground truth 'clap'. Both involve hand movements, but the gestures are distinct and not interchangeable."
videos/session_0041_slide.mp4,slide,Action: standing,0.2,The predicted action 'standing' is a generic static description and does not match the dynamic ground truth action 'slide'. There is no semantic or temporal overlap between the two actions.
videos/session_0042_drawzigzag.mp4,drawzigzag,Action: Opening door,0.0,The predicted action 'Opening door' is completely unrelated to the ground truth action 'drawzigzag'. There is no semantic or temporal overlap between the two actions.
videos/session_0043_dodge.mp4,dodge,Action: standing,0.2,"The ground truth action 'dodge' implies a dynamic and evasive movement, while the VLM's prediction 'standing' is a static and passive description. The two actions are semantically unrelated, and the prediction fails to capture the dynamic nature of the ground truth label."
videos/session_0044_bowling.mp4,bowling,Action: standing,0.2,"The predicted action 'standing' is a generic static description, while the ground truth action 'bowling' is a dynamic and specific activity. There is no clear temporal or semantic relationship between the two, making the prediction incorrect."
videos/session_0045_liftupahand.mp4,liftupahand,Action: waving,0.9,"The predicted action 'waving' is semantically very close to the ground truth 'liftupahand', as both involve raising a hand. The slight difference in specific motion (waving vs. lifting) is minor and contextually plausible."
videos/session_0046_tap.mp4,tap,Action: punching,0.3,"The prediction 'punching' is semantically different from the ground truth action 'tap'. While both involve hand movements, 'punching' implies a forceful strike, whereas 'tap' is a light touch. The actions are not closely related enough for a higher score."
videos/session_0047_spreadandpinch.mp4,spreadandpinch,Action: waving,0.2,The predicted action 'waving' does not match the ground truth action 'spreadandpinch'. These are distinct hand gestures with no semantic overlap.
videos/session_0048_drawtriangle.mp4,drawtriangle,Action: waving,0.1,The prediction 'waving' is semantically unrelated to the ground truth action 'drawtriangle'. There is no meaningful overlap or temporal relationship between the two actions.
videos/session_0049_sneeze.mp4,sneeze,Action: bending,0.2,The predicted action 'bending' is not semantically related to the ground truth action 'sneeze'. These are entirely different actions with no temporal or contextual overlap.
videos/session_0050_cough.mp4,cough,Action: Coughing,1.0,The VLM's predicted action 'Coughing' is an exact semantic match to the ground truth action 'cough'.
videos/session_0051_stagger.mp4,stagger,Action: dancing,0.2,"The prediction 'dancing' is significantly different from the ground truth 'stagger'. While both involve body movement, 'stagger' implies instability or unsteadiness, whereas 'dancing' is a rhythmic and intentional activity. The semantic gap is large, warranting a low score."
videos/session_0052_yawn.mp4,yawn,Action: Coughing,0.1,The predicted action 'coughing' is completely different from the ground truth action 'yawn'. Both are facial actions but are semantically unrelated.
videos/session_0053_blownose.mp4,blownose,Action: Talking on the phone,0.2,"The predicted action 'Talking on the phone' is completely unrelated to the ground truth action 'blownose'. They involve different body parts and contexts, resulting in a low score."
videos/session_0054_stretchoneself.mp4,stretchoneself,Action: Stretching,1.0,"The VLM's prediction 'Stretching' is a direct semantic match to the ground truth action 'stretchoneself', indicating a correct and precise identification of the activity."
videos/session_0055_touchface.mp4,touchface,Action: Talking on phone,0.6,"The prediction 'Talking on phone' involves holding a phone near the face, which is a plausible but less specific interpretation of the ground truth action 'touchface'. While related, it introduces additional context (talking) that is not explicitly part of the ground truth action."
videos/session_0056_handshake.mp4,handshake,Action: shaking hands,1.0,"The prediction 'shaking hands' is a semantic equivalent of the ground truth action 'handshake', indicating an exact match."
videos/session_0057_hug.mp4,hug,Action: hugging,1.0,The prediction 'hugging' is a direct semantic equivalent of the ground truth action 'hug'.
videos/session_0058_pushsomeone.mp4,pushsomeone,Action: handshake,0.4,"The prediction 'handshake' is a related but less specific action compared to the ground truth 'pushsomeone'. Both involve interaction, but the nature of the interaction differs."
videos/session_0059_kicksomeone.mp4,kicksomeone,Action: talking,0.1,"The VLM's prediction 'talking' is completely different from the ground truth action 'kicksomeone'. There is no semantic or contextual overlap between the two actions, resulting in a very low score."
videos/session_0060_punchsomeone.mp4,punchsomeone,Action: Knife threat,0.5,"The VLM prediction 'Knife threat' is related to the ground truth 'punchsomeone' as both involve aggressive interactions, but they are not semantically equivalent. The actions are distinct, with one involving a threat with a weapon and the other involving a physical strike. Therefore, a medium score is appropriate."
videos/session_0061_conversation.mp4,conversation,Action: talking,1.0,The prediction 'talking' is a direct semantic equivalent of the ground truth 'conversation'. Both actions describe the same activity.
videos/session_0062_sit.mp4,sit,Action: standing,0.2,"The prediction 'standing' is not a temporal part of the ground truth action 'sit'. While standing could precede sitting, the video likely shows a static posture, which does not align with the dynamic context of the 'sit' label."
videos/session_0063_walk.mp4,walk,Action: punching,0.2,"The predicted action 'punching' is completely different from the ground truth action 'walk', and there is no semantic or temporal relationship between the two."
videos/session_0064_bow.mp4,bow,Action: picking up object,0.2,"The prediction 'picking up object' does not align with the ground truth action 'bow'. The two actions are semantically distinct and unrelated, leading to a low score."
videos/session_0065_sleep.mp4,sleep,Action: Lying,1.0,"The predicted action 'Lying' is a direct semantic equivalent of the ground truth action 'sleep', as lying down is the typical posture for sleeping."
videos/session_0066_dance.mp4,dance,Action: raising arms,0.8,"The prediction 'raising arms' is a specific movement that is part of the broader action 'dancing'. While not a complete match, it is a plausible and related component of the ground truth action."
videos/session_0067_jog.mp4,jog,Action: punching,0.2,The predicted action 'punching' is a completely different action from the ground truth 'jog'. There is no semantic or temporal overlap between the two actions.
videos/session_0068_falldown.mp4,falldown,Action: burpee,0.0,"The predicted action 'burpee' is a structured exercise and has no semantic or temporal relation to the ground truth action 'falldown', which describes an involuntary or accidental action."
videos/session_0069_jump.mp4,jump,Action: punching,0.2,The predicted action 'punching' is completely different from the ground truth action 'jump'. There is no semantic or contextual overlap between the two actions.
videos/session_0070_jumpingjack.mp4,jumpingjack,Action: stretching,0.3,"The predicted action 'stretching' is a different exercise from the ground truth 'jumpingjack'. While both are exercises, they are not semantically equivalent or closely related enough to warrant a higher score."
videos/session_0071_squat.mp4,squat,Action: Squatting,1.0,The prediction 'Squatting' is a direct semantic equivalent of the ground truth action 'squat'.
videos/session_0072_lunge.mp4,lunge,Action: lunge,1.0,"The predicted action 'lunge' is an exact match to the ground truth action 'lunge', demonstrating perfect alignment."
videos/session_0073_turn.mp4,turn,Action: standing,0.2,"The ground truth action 'turn' implies dynamic movement, while the prediction 'standing' is a static description. There is no semantic or temporal relationship between the two, resulting in a low score."
videos/session_0074_pushup.mp4,pushup,Action: crawling,0.2,"The predicted action 'crawling' is significantly different from the ground truth 'pushup'. While both are floor-based exercises, they involve different body mechanics and postures, making them semantically distinct."
videos/session_0075_legraise.mp4,legraise,Action: Standing,0.1,"The VLM predicted 'Standing' which is a generic static description, while the ground truth 'legraise' is a specific dynamic exercise. There is no semantic or temporal overlap between the two actions."
videos/session_0076_airdrum.mp4,airdrum,Action: Arms Crossed,0.2,"The predicted action 'Arms Crossed' does not match the ground truth 'airdrum'. Airdrumming involves dynamic arm movements to simulate playing drums, whereas 'Arms Crossed' is a static and unrelated pose. The prediction is therefore incorrect and unrelated."
videos/session_0077_boxing.mp4,boxing,Action: punching,1.0,"The predicted action 'punching' is a specific and valid component of the ground truth action 'boxing', making it a semantic equivalent."
videos/session_0078_shakehead.mp4,shakehead,Action: standing,0.2,"The ground truth action 'shakehead' involves dynamic head movement, while the prediction 'standing' describes a static posture. These actions are semantically unrelated and do not align temporally or contextually."
videos/session_0079_answerphone.mp4,answerphone,Action: Talking on phone,1.0,The predicted action 'Talking on phone' is a direct semantic equivalent of the ground truth 'answerphone'.
videos/session_0080_eat.mp4,eat,Action: Talking on the phone,0.1,The predicted action 'Talking on the phone' is semantically unrelated to the ground truth action 'eat'. There is no overlap or logical connection between the two actions.
videos/session_0081_drink.mp4,drink,Action: Drinking,1.0,The prediction 'Drinking' is a direct semantic equivalent of the ground truth action 'drink'.
videos/session_0082_wipeface.mp4,wipeface,Action: Talking on phone,0.2,The prediction 'Talking on phone' does not match the ground truth action 'wipeface' either semantically or temporally. These are distinct and unrelated actions.
videos/session_0083_pickup.mp4,pickup,Action: Tying shoelaces,0.3,"The predicted action 'tying shoelaces' is unrelated to the ground truth action 'pickup'. While both involve some level of manual dexterity, the contexts and intents of the actions are distinctly different."
videos/session_0084_jumprope.mp4,jumprope,Action: jumping rope,1.0,"The prediction 'jumping rope' is an exact match to the ground truth action 'jumprope', indicating perfect semantic and action alignment."
videos/session_0085_moppingfloor.mp4,moppingfloor,Action: sweeping,0.8,"The predicted action 'sweeping' is semantically very similar to the ground truth 'moppingfloor', as both involve cleaning the floor with a tool. While not an exact match, the actions are closely related and contextually valid."
videos/session_0086_brushhair.mp4,brushhair,Action: Scratching Head,0.6,"The predicted action 'Scratching Head' is related to the ground truth 'brushhair' as both involve head/hair interaction, but it is not a direct match. It is a plausible but less specific action, warranting a medium score."
videos/session_0087_bicepcurl.mp4,bicepcurl,Action: waving,0.2,The predicted action 'waving' is completely different from the ground truth action 'bicepcurl'. There is no semantic or temporal overlap between the two actions.
videos/session_0088_playphone.mp4,playphone,Action: Talking on the phone,1.0,"The prediction 'Talking on the phone' is a semantic equivalent of the ground truth action 'playphone', which both describe the same activity."
videos/session_0089_brushteeth.mp4,brushteeth,Action: Talking on phone,0.1,The predicted action 'Talking on phone' is completely unrelated to the ground truth action 'brushteeth'. There is no semantic or temporal overlap between the two actions.
videos/session_0090_type.mp4,type,Action: sitting,0.0,The ground truth action 'type' does not semantically match the VLM's prediction 'sitting'. There is no logical or temporal relationship between typing and sitting in this context.
videos/session_0091_thumbup.mp4,thumbup,Action: thumbs_up,1.0,The prediction 'thumbs_up' is a direct semantic equivalent of the ground truth action 'thumbup'.
videos/session_0092_thumbdown.mp4,thumbdown,Action: pointing,0.6,"The prediction 'pointing' is related to the ground truth 'thumbdown' as both involve hand gestures, but they are not semantically equivalent. A 'thumbdown' is a specific gesture indicating disapproval, while 'pointing' is a more general gesture. Therefore, a medium score is appropriate."
videos/session_0093_makeoksign.mp4,makeoksign,Action: making peace sign,0.2,"The predicted action 'making peace sign' is semantically different from the ground truth 'makeoksign'. Both involve hand gestures, but they are distinct gestures with no overlap in meaning or execution."
videos/session_0094_makevictorysign.mp4,makevictorysign,Action: waving,0.2,The predicted action 'waving' does not match the ground truth 'makevictorysign'. These are distinct hand gestures with no semantic overlap.
videos/session_0095_drawcircleclockwise.mp4,drawcircleclockwise,Action: waving,0.3,"The predicted action 'waving' is semantically different from the ground truth action 'drawcircleclockwise'. While both involve hand movements, the intent and motion are distinct, leading to a low score."
