video_path,ground_truth_label,vlm_raw_response,judge_score,judge_reasoning
videos/session_0474_makevictorysign.mp4,makevictorysign,Action: peace sign,1.0,"The prediction 'peace sign' is a direct semantic equivalent of the ground truth action 'makevictorysign', as both refer to the same gesture."
videos/session_0475_drawcircleclockwise.mp4,drawcircleclockwise,Action: opening door,0.1,The predicted action 'opening door' is completely unrelated to the ground truth action 'drawcircleclockwise'. There is no semantic or temporal overlap between these actions.
videos/session_0476_drawcirclecounterclockwise.mp4,drawcirclecounterclockwise,Action: waving,0.2,"The predicted action 'waving' is significantly different from the ground truth action 'drawcirclecounterclockwise'. While both involve arm movements, the specific gestures and intentions are not semantically equivalent. This warrants a low score."
videos/session_0477_stopsign.mp4,stopsign,Action: waving,0.1,"The predicted action 'waving' does not match the ground truth action 'stopsign' in any meaningful way. 'Stopsign' likely refers to a specific gesture or action related to a stop sign, while 'waving' is a completely different action with no semantic overlap."
videos/session_0478_pullhandin.mp4,pullhandin,Action: Talking on phone,0.2,"The ground truth action 'pullhandin' is a specific hand gesture, while the VLM predicted 'Talking on phone', which is a completely unrelated activity. There is no semantic or temporal overlap between the two actions."
videos/session_0479_pushhandaway.mp4,pushhandaway,Action: waving,0.6,"The predicted action 'waving' is related to the ground truth 'pushhandaway' as both involve hand movements, but they are not semantically equivalent. The action is plausible but not specific enough for a higher score."
videos/session_0480_handwave.mp4,handwave,Action: waving,1.0,The prediction 'waving' is a semantic equivalent of the ground truth action 'handwave'.
videos/session_0481_sweep.mp4,sweep,Action: waving,0.2,"The predicted action 'waving' does not match the ground truth action 'sweep' either semantically or contextually. They are completely different activities, warranting a low score."
videos/session_0482_clap.mp4,clap,Action: clapping hands,1.0,The prediction 'clapping hands' is a direct semantic equivalent of the ground truth action 'clap'.
videos/session_0483_slide.mp4,slide,Action: Standing,0.2,"The ground truth action is 'slide', which implies a dynamic movement, while the prediction 'Standing' describes a static action. There is no semantic overlap or temporal relation between the two actions."
videos/session_0484_drawzigzag.mp4,drawzigzag,Action: talking on phone,0.1,The predicted action 'talking on phone' is completely unrelated to the ground truth action 'drawzigzag'. There is no semantic or temporal overlap between the two actions.
videos/session_0485_dodge.mp4,dodge,Action: standing,0.2,"The prediction 'standing' is a static action and does not match the dynamic ground truth action 'dodge', which involves movement to avoid something. There is no semantic or temporal overlap between the two actions."
videos/session_0486_bowling.mp4,bowling,Action: clapping,0.1,The predicted action 'clapping' is completely unrelated to the ground truth action 'bowling'. There is no semantic or temporal overlap between the two actions.
videos/session_0487_liftupahand.mp4,liftupahand,Action: waving,0.8,"The predicted action 'waving' is semantically similar to the ground truth 'liftupahand' as both involve the movement of a hand upwards, making it a plausible and closely related action."
videos/session_0488_tap.mp4,tap,Action: waving,0.2,"The predicted action 'waving' is semantically different from the ground truth action 'tap'. Both are specific hand movements, but they describe distinct actions without overlap or temporal relation."
videos/session_0489_spreadandpinch.mp4,spreadandpinch,Action: punching,0.3,"The predicted action 'punching' is semantically different from the ground truth 'spreadandpinch'. While both involve hand movements, 'punching' implies a striking motion, whereas 'spreadandpinch' involves opening and closing the hand. The actions are not equivalent or closely related."
videos/session_0490_drawtriangle.mp4,drawtriangle,Action: pointing,0.6,"The prediction 'pointing' is somewhat related to 'drawtriangle' as both involve hand/arm movements, but it lacks the specificity of drawing a triangle, which is a more complex action."
videos/session_0491_sneeze.mp4,sneeze,Action: adjusting glasses,0.1,The predicted action 'adjusting glasses' is completely unrelated to the ground truth action 'sneeze'. There is no semantic or temporal overlap between the two actions.
videos/session_0492_cough.mp4,cough,Action: Talking on phone,0.2,"The predicted action 'Talking on phone' is unrelated to the ground truth action 'cough'. They are distinct and unrelated actions, warranting a low score."
videos/session_0493_stagger.mp4,stagger,Action: turning,0.6,"The prediction 'turning' is related to 'stagger' as both involve unsteady or unbalanced movement, but 'turning' is less specific and does not fully capture the lack of stability implied by 'stagger'."
videos/session_0494_yawn.mp4,yawn,Action: Drinking,0.1,The predicted action 'drinking' is completely different from the ground truth action 'yawn'. There is no semantic or temporal overlap between the two actions.
videos/session_0495_blownose.mp4,blownose,Action: Coughing,0.2,"The prediction 'coughing' is semantically distinct from the ground truth 'blownose', as they involve different upper body actions and contexts."
videos/session_0496_stretchoneself.mp4,stretchoneself,Action: T-pose,0.4,"The VLM predicted 'T-pose', which is a specific static posture, while the ground truth 'stretchoneself' implies a dynamic action of stretching. The two actions are somewhat related as both involve body positioning, but 'T-pose' is not a valid temporal part or semantic equivalent of stretching. Hence, a medium score is appropriate."
videos/session_0497_touchface.mp4,touchface,Action: saluting,0.3,"The prediction 'saluting' is semantically different from the ground truth 'touchface'. Both involve hand movement near the head, but the intent and action are distinct."
videos/session_0498_sleep.mp4,sleep,Action: lying,1.0,"The prediction 'lying' is semantically equivalent to the ground truth action 'sleep', as lying down is a common posture associated with sleeping."
videos/session_0499_handshake.mp4,handshake,Action: shaking hands,1.0,The prediction 'shaking hands' is a semantic equivalent of the ground truth action 'handshake'.
videos/session_0500_hug.mp4,hug,Action: hugging,1.0,The VLM's predicted action 'hugging' is a direct semantic match to the ground truth action 'hug'.
videos/session_0501_pushsomeone.mp4,pushsomeone,Action: talking,0.1,"The ground truth action 'pushsomeone' involves physical interaction, while the VLM predicted 'talking', which is a completely different and unrelated action."
videos/session_0502_kicksomeone.mp4,kicksomeone,Action: shaking hands,0.1,"The VLM's prediction 'shaking hands' is completely unrelated to the ground truth action 'kicksomeone'. These actions are distinct both in motion and intent, with no semantic overlap."
videos/session_0503_punchsomeone.mp4,punchsomeone,Action: conversation,0.2,The predicted action 'conversation' is completely unrelated to the ground truth action 'punchsomeone'. There is no semantic or temporal overlap between the two actions.
videos/session_0504_conversation.mp4,conversation,Action: object handover,0.3,"The predicted action 'object handover' is not semantically related to the ground truth action 'conversation'. While both may involve interaction, they describe fundamentally different activities."
videos/session_0505_bow.mp4,bow,Action: bending,0.9,"The prediction 'bending' is semantically very close to the ground truth 'bow', as bowing typically involves bending the upper body. This constitutes a near-equivalent action, warranting a high score."
videos/session_0506_pickup.mp4,pickup,Action: Bending down to pick up an object,1.0,The prediction 'Bending down to pick up an object' is a semantic equivalent of the ground truth action 'pickup'.
videos/session_0507_pushhandaway.mp4,pushhandaway,Action: adjusting glasses,0.1,"The predicted action 'adjusting glasses' is unrelated to the ground truth action 'pushhandaway'. The two actions involve different movements and intentions, resulting in a low score."
videos/session_0508_handwave.mp4,handwave,Action: Saluting,0.5,"The prediction 'Saluting' is related to 'handwave' as both involve hand movements, but they are not semantically equivalent. The actions are distinct enough to warrant a medium score."
videos/session_0509_sweep.mp4,sweep,Action: standing,0.2,The prediction 'standing' is a static description that does not align with the dynamic action of 'sweep'. There is no semantic or temporal relationship between the two actions.
videos/session_0510_clap.mp4,clap,Action: clapping,1.0,The prediction 'clapping' is a semantic equivalent of the ground truth action 'clap'.
videos/session_0511_slide.mp4,slide,Action: waving,0.1,The predicted action 'waving' is completely unrelated to the ground truth action 'slide'. There is no semantic or temporal overlap between the two actions.
videos/session_0512_drawzigzag.mp4,drawzigzag,Action: pointing,0.3,"The predicted action 'pointing' is semantically different from the ground truth action 'drawzigzag'. While both involve hand movements, the intent and motion are distinct, leading to a low score."
videos/session_0513_dodge.mp4,dodge,Action: standing,0.2,"The VLM predicted 'standing', which is a static action and does not align with the dynamic ground truth action 'dodge'. The actions are semantically different, and 'standing' does not capture the essence of 'dodge'."
videos/session_0514_bowling.mp4,bowling,Action: saluting,0.1,The predicted action 'saluting' is completely different from the ground truth action 'bowling'. There is no semantic or temporal relationship between the two actions.
videos/session_0515_liftupahand.mp4,liftupahand,Action: standing,0.2,"The VLM predicted 'standing' while the ground truth is 'liftupahand'. These are unrelated actions; 'liftupahand' involves raising a hand, which is not captured by the static 'standing' prediction."
videos/session_0516_tap.mp4,tap,Action: phoning,0.2,The predicted action 'phoning' does not match the ground truth action 'tap' in any semantic or temporal sense. They are unrelated actions.
videos/session_0517_spreadandpinch.mp4,spreadandpinch,Action: waving,0.2,"The predicted action 'waving' is significantly different from the ground truth 'spreadandpinch', as they involve distinct hand movements and gestures."
videos/session_0518_drawtriangle.mp4,drawtriangle,Action: Pointing,0.3,"The prediction 'Pointing' is not semantically related to the ground truth action 'drawtriangle'. While both involve hand movements, 'drawtriangle' implies a more complex and specific motion of drawing a shape, whereas 'pointing' is a simpler, unrelated gesture."
videos/session_0519_sneeze.mp4,sneeze,Action: coughing,0.8,The prediction 'coughing' is semantically similar to the ground truth 'sneeze' as both are involuntary respiratory actions.
videos/session_0520_cough.mp4,cough,Action: standing,0.2,"The ground truth action is 'cough', which is a specific and brief action. The VLM predicted 'standing', which is a generic and static state that does not match or relate to the action of coughing. This is a clear mismatch."
videos/session_0521_stagger.mp4,stagger,Action: Standing,0.2,"The ground truth action 'stagger' implies an unsteady or swaying movement, which is dynamic and specific. The VLM's prediction 'Standing' is a static and generic description that does not capture the essence of 'stagger'. This mismatch warrants a low score."
videos/session_0522_yawn.mp4,yawn,Action: coughing,0.2,"The predicted action 'coughing' is semantically and physically unrelated to the ground truth action 'yawn'. Both are facial actions, but they are distinct and not temporally related."
videos/session_0523_blownose.mp4,blownose,Action: putting on a mask,0.2,The predicted action 'putting on a mask' is semantically unrelated to the ground truth action 'blownose'. Both involve the face area but are distinct actions with no overlap in purpose or motion.
videos/session_0524_stretchoneself.mp4,stretchoneself,Action: hand waving,0.2,"The predicted action 'hand waving' is not semantically related to 'stretchoneself'. While both involve arm movement, the intent and form of the actions are distinct, resulting in a low score."
videos/session_0525_touchface.mp4,touchface,Action: standing,0.2,"The ground truth action 'touchface' involves a specific hand-to-face movement, while the VLM's prediction 'standing' describes a generic static posture. There is no semantic or temporal overlap between the two actions, making the prediction incorrect."
videos/session_0526_pushup.mp4,pushup,Action: Crawling,0.2,"The predicted action 'crawling' is significantly different from the ground truth action 'pushup', which involves a prone position with upper body strength. Crawling is a locomotive action on hands and knees, lacking the specific form and intent of a pushup, resulting in a low score."
videos/session_0527_handshake.mp4,handshake,Action: Shaking hands,1.0,"The prediction 'Shaking hands' is a direct semantic equivalent of the ground truth action 'handshake', indicating a perfect match."
videos/session_0528_hug.mp4,hug,Action: hugging,1.0,The prediction 'hugging' is a semantic equivalent of the ground truth action 'hug'.
videos/session_0529_pushsomeone.mp4,pushsomeone,Action: handshake,0.3,The predicted action 'handshake' is a completely different action from the ground truth 'pushsomeone'. Both involve interaction but are not semantically equivalent or temporally related.
videos/session_0530_kicksomeone.mp4,kicksomeone,Action: two people talking,0.1,"The predicted action 'two people talking' is completely different from the ground truth action 'kicksomeone', which involves physical aggression. There is no semantic overlap or logical connection between the two actions."
videos/session_0531_punchsomeone.mp4,punchsomeone,Action: shaking hands,0.2,The predicted action 'shaking hands' is completely different from the ground truth action 'punch someone'. They are unrelated and involve opposite types of interactions.
videos/session_0532_conversation.mp4,conversation,Action: talking,1.0,The prediction 'talking' is a direct semantic equivalent of the ground truth action 'conversation'.
videos/session_0533_sit.mp4,sit,Action: sitting down,1.0,The prediction 'sitting down' is a valid temporal part of the ground truth action 'sit'.
videos/session_0534_walk.mp4,walk,Action: turning around,0.5,"The prediction 'turning around' is somewhat related to 'walk' as it involves movement, but it does not capture the essence of walking. It is a plausible but less specific action."
videos/session_0535_bow.mp4,bow,Action: bending down,0.9,"The prediction 'bending down' is semantically very close to the ground truth 'bow', as bowing typically involves bending down as a key component."
videos/session_0536_sleep.mp4,sleep,Action: Lying,1.0,"The prediction 'Lying' is semantically equivalent to the ground truth action 'sleep', as lying is the typical posture for sleeping."
videos/session_0537_dance.mp4,dance,Action: raising both arms,0.7,"The prediction 'raising both arms' is a specific movement that can be part of dancing, but it is not a direct semantic match to 'dance'. However, it is a plausible and related action within the context of dancing, warranting a medium-high score."
videos/session_0538_jog.mp4,jog,Action: standing,0.2,"The ground truth action 'jog' is dynamic, while the VLM predicted 'standing', which is a static action. This is a clear mismatch and falls under the 'Generic static label for clearly dynamic GT' criterion, warranting a low score."
videos/session_0539_falldown.mp4,falldown,Action: Falling,1.0,The prediction 'Falling' is a direct and semantic equivalent of the ground truth action 'falldown'.
videos/session_0540_jump.mp4,jump,Action: jumping jacks,1.0,"The prediction 'jumping jacks' is a specific form of the ground truth action 'jump', making it a correct and semantically equivalent match."
videos/session_0541_jumpingjack.mp4,jumpingjack,Action: Jumping Jacks,1.0,The predicted action 'Jumping Jacks' is an exact match to the ground truth action 'jumpingjack'.
videos/session_0542_squat.mp4,squat,Action: Squatting,1.0,The prediction 'Squatting' is a direct and exact semantic match to the ground truth action 'squat'.
videos/session_0543_lunge.mp4,lunge,Action: Punching,0.2,"The predicted action 'Punching' is completely different from the ground truth action 'lunge'. Both are specific exercises, but they involve distinct movements and muscle groups."
videos/session_0544_turn.mp4,turn,Action: Standing,0.2,"The ground truth action 'turn' implies a dynamic movement involving rotation, while the VLM's prediction 'standing' is a static and unrelated action. There is no semantic or temporal overlap between the two."
videos/session_0545_pushup.mp4,pushup,Action: Crawling,0.2,"The predicted action 'Crawling' is significantly different from the ground truth action 'pushup'. While both are floor-based exercises, the movements and body positions are distinct, resulting in a low score."
videos/session_0546_legraise.mp4,legraise,Action: Marching in place,0.6,"The prediction 'Marching in place' is a leg-related exercise, which is somewhat related to 'legraise', but it is not semantically equivalent. Both actions involve leg movements, but the specific motion differs, leading to a medium score."
videos/session_0547_airdrum.mp4,airdrum,Action: Boxing,0.2,"The predicted action 'boxing' is semantically and visually distinct from the ground truth action 'airdrum'. While both involve hand movements, the context and execution are fundamentally different, leading to a low score."
videos/session_0548_boxing.mp4,boxing,Action: punching,1.0,"The prediction 'punching' is a specific and accurate description of the ground truth action 'boxing', as punching is a core component of boxing."
videos/session_0549_shakehead.mp4,shakehead,Action: standing,0.2,"The prediction 'standing' does not match the ground truth 'shakehead', as these are unrelated and distinct actions. 'Shakehead' involves head movement, while 'standing' is a static posture."
videos/session_0550_answerphone.mp4,answerphone,Action: talking on phone,1.0,The prediction 'talking on phone' is a direct semantic equivalent of the ground truth action 'answerphone'.
videos/session_0551_eat.mp4,eat,Action: using remote control,0.2,The predicted action 'using remote control' is unrelated to the ground truth action 'eat'. There is no semantic or logical connection between the two actions.
videos/session_0552_drink.mp4,drink,Action: Talking on phone,0.2,The predicted action 'Talking on phone' is unrelated to the ground truth action 'drink'. There is no semantic or temporal overlap between the two actions.
videos/session_0553_wipeface.mp4,wipeface,Action: Talking on phone,0.1,The predicted action 'Talking on phone' is unrelated to the ground truth action 'wipeface'. There is no semantic or temporal overlap between the two actions.
videos/session_0554_pickup.mp4,pickup,Action: bending down,0.8,"The prediction 'bending down' is a plausible and closely related action to 'pickup', as bending down is often a necessary precursor to picking something up."
videos/session_0555_jumprope.mp4,jumprope,Action: waving arms,0.3,"The prediction 'waving arms' is a completely different action from the ground truth 'jumproping'. While both involve arm movement, the context and primary action are unrelated, leading to a low score."
videos/session_0556_moppingfloor.mp4,moppingfloor,Action: golf swing,0.1,The predicted action 'golf swing' is completely different from the ground truth action 'moppingfloor'. There is no semantic or temporal relationship between the two actions.
videos/session_0557_brushhair.mp4,brushhair,Action: talking on the phone,0.0,The VLM's prediction 'talking on the phone' is completely different from the ground truth action 'brushhair'. There is no semantic or contextual similarity between the two actions.
videos/session_0558_bicepcurl.mp4,bicepcurl,Action: drinking water,0.2,"The predicted action 'drinking water' is completely unrelated to the ground truth action 'bicepcurl', which is a specific exercise. There is no semantic or contextual overlap between the two actions."
videos/session_0559_playphone.mp4,playphone,Action: clapping,0.1,The predicted action 'clapping' is completely unrelated to the ground truth action 'playphone'. There is no semantic or temporal overlap between the two actions.
videos/session_0560_brushteeth.mp4,brushteeth,Action: Coughing,0.1,The predicted action 'Coughing' is completely unrelated to the ground truth action 'brushteeth'. There is no semantic or contextual overlap between the two actions.
videos/session_0561_type.mp4,type,Action: Using phone,0.2,"The ground truth 'type' is ambiguous and does not clearly relate to the predicted action 'Using phone'. Without context, this appears to be a mismatch or hallucination."
videos/session_0562_thumbup.mp4,thumbup,Action: thumbs up,1.0,"The prediction 'thumbs up' is a direct semantic match to the ground truth action 'thumbup', indicating an exact alignment."
videos/session_0563_thumbdown.mp4,thumbdown,Action: waving,0.1,The predicted action 'waving' is completely different from the ground truth action 'thumbdown'. There is no semantic or temporal relationship between the two actions.
videos/session_0564_makeoksign.mp4,makeoksign,Action: Victory Sign,0.2,"The predicted action 'Victory Sign' is semantically different from the ground truth action 'makeoksign'. Both are hand gestures but represent distinct signs, leading to a low score."
videos/session_0565_makevictorysign.mp4,makevictorysign,Action: Showing peace sign,1.0,The prediction 'Showing peace sign' is semantically equivalent to the ground truth action 'makevictorysign'. Both describe the same gesture.
videos/session_0566_drawcircleclockwise.mp4,drawcircleclockwise,Action: pointing,0.2,"The predicted action 'pointing' is not semantically or temporally related to the ground truth action 'drawcircleclockwise'. These are distinct actions, and the prediction does not capture the essence of drawing a circle."
videos/session_0567_drawcirclecounterclockwise.mp4,drawcirclecounterclockwise,Action: waving,0.2,"The predicted action 'waving' is semantically unrelated to the ground truth action 'drawcirclecounterclockwise'. While both involve arm movements, the specific intent and motion pattern are different, leading to a low score."
videos/session_0568_stopsign.mp4,stopsign,Action: waving,0.2,The predicted action 'waving' is completely unrelated to the ground truth action 'stopsign'. There is no semantic or contextual overlap between the two.
videos/session_0569_pullhandin.mp4,pullhandin,Action: smoking,0.0,The predicted action 'smoking' is completely unrelated to the ground truth action 'pullhandin'. There is no semantic or contextual overlap between the two actions.
videos/session_0570_pushhandaway.mp4,pushhandaway,Action: waving,0.3,"The predicted action 'waving' is semantically different from the ground truth 'pushhandaway'. While both involve hand movements, the intent and motion are distinct, making this a low-score match."
videos/session_0571_handwave.mp4,handwave,Action: waving,1.0,"The prediction 'waving' is a direct semantic equivalent of the ground truth action 'handwave', indicating a perfect match."
videos/session_0572_sweep.mp4,sweep,Action: aiming gun,0.1,The predicted action 'aiming gun' is completely unrelated to the ground truth action 'sweep'. There is no semantic or contextual overlap between the two actions.
videos/session_0573_clap.mp4,clap,Action: Clapping,1.0,The prediction 'Clapping' is a direct semantic match to the ground truth action 'clap'.
videos/session_0574_slide.mp4,slide,Action: waving hand,0.1,The predicted action 'waving hand' is completely unrelated to the ground truth action 'slide'. There is no semantic or temporal overlap between the two actions.
